<?xml version="1.0" encoding="UTF-8"?>
<xs:schema xmlns:xs="http://www.w3.org/2001/XMLSchema">

  <xs:element name="etudiants">
    <xs:complexType>
      <xs:sequence>
        <xs:element name="employe" type="TypeEmploye"
                    minOccurs="1" maxOccurs="unbounded"/>
      </xs:sequence>
    </xs:complexType>
  </xs:element>

  <xs:complexType name="TypeEmploye">
    <xs:sequence>

      <xs:element name="nom">
        <xs:simpleType>
          <xs:restriction base="xs:string">
            <xs:minLength value="1"/>
          </xs:restriction>
        </xs:simpleType>
      </xs:element>

      <xs:element name="prenom">
        <xs:simpleType>
          <xs:restriction base="xs:string">
            <xs:minLength value="1"/>
          </xs:restriction>
        </xs:simpleType>
      </xs:element>

      <xs:element name="email">
        <xs:simpleType>
          <xs:restriction base="xs:string">
            <xs:minLength value="5"/>
          </xs:restriction>
        </xs:simpleType>
      </xs:element>

      <xs:element name="poste">
        <xs:simpleType>
          <xs:restriction base="xs:string">
            <xs:minLength value="1"/>
          </xs:restriction>
        </xs:simpleType>
      </xs:element>

      <xs:element name="departement">
        <xs:simpleType>
          <xs:restriction base="xs:string">
            <xs:enumeration value="Informatique"/>
            <xs:enumeration value="Finance"/>
            <xs:enumeration value="Marketing"/>
            <xs:enumeration value="Logistique"/>
            <xs:enumeration value="Cybersécurité"/>
          </xs:restriction>
        </xs:simpleType>
      </xs:element>

      <xs:element name="salaire">
        <xs:simpleType>
          <xs:restriction base="xs:decimal">
            <xs:minInclusive value="0"/>
            <xs:maxInclusive value="100000"/>
          </xs:restriction>
        </xs:simpleType>
      </xs:element>

      <xs:element name="statut">
        <xs:simpleType>
          <xs:restriction base="xs:string">
            <xs:enumeration value="actif"/>
            <xs:enumeration value="inactif"/>
          </xs:restriction>
        </xs:simpleType>
      </xs:element>

    </xs:sequence>

    <xs:attribute name="id" use="required">
      <xs:simpleType>
        <xs:restriction base="xs:string">
          <xs:pattern value="E[0-9]{2}"/>
        </xs:restriction>
      </xs:simpleType>
    </xs:attribute>

  </xs:complexType>

</xs:schema>